title,price,rating,reviews,availability,link,image_url
"Alba Botanica Sunscreen Lotion, Sport, SPF 45, Fragrance Free, 4 Oz (Packaging May Vary)",$6.59,4.6 out of 5 stars,917 ratings,In Stock,https://www.amazon.com/sspa/click?ie=UTF8&spc=MTo0NTAwMzk5NjExMzQ0OTE1OjE2ODg5NzEwMDM6c3BfYXRmX25leHQ6MjAwMTY1Njc4NDczNjk4OjowOjo&url=%2FAlba-Botanica-Emollient-Sport-Sunscreen%2Fdp%2FB00AJIXZZ0%2Fref%3Dsr_1_49_sspa%3Fcrid%3DBCICLEMKVXND%26keywords%3Dsunscreen%26qid%3D1688971003%26sprefix%3Dsuns%252Caps%252C533%26sr%3D8-49-spons%26sp_csd%3Dd2lkZ2V0TmFtZT1zcF9hdGZfbmV4dA%26psc%3D1,https://m.media-amazon.com/images/I/41Mucz2GMrL._SX300_SY300_QL70_ML2_.jpg
"RAIN OR SHINE Anti Aging Face Sunscreen SPF 50 for Clear Skin w/Green Tea, Hyaluronic Acid, Vitamin C, Vitamin E Oil, Ginseng Extract, Licorice Root – SPF Moisturizer for Face, Fragrance Free 2.03 Oz",$32.00,4.6 out of 5 stars,767 ratings,In Stock,https://www.amazon.com/sspa/click?ie=UTF8&spc=MTo0NTAwMzk5NjExMzQ0OTE1OjE2ODg5NzEwMDM6c3BfYXRmX25leHQ6MjAwMDU1MTA0NTA3NDQxOjowOjo&url=%2FSunscreen-Hyaluronic-Vitamin-Ginseng-Licorice%2Fdp%2FB08XM3PKYR%2Fref%3Dsr_1_50_sspa%3Fcrid%3DBCICLEMKVXND%26keywords%3Dsunscreen%26qid%3D1688971003%26sprefix%3Dsuns%252Caps%252C533%26sr%3D8-50-spons%26sp_csd%3Dd2lkZ2V0TmFtZT1zcF9hdGZfbmV4dA%26psc%3D1,https://m.media-amazon.com/images/I/31o3sz+pz1L._SY300_SX300_.jpg
"COSRX Daily SPF 50 Vitamin E Vitalizing Sunscreen, OTC Broad Spectrum UVA & UVB Protection, Lightweight & No White Cast, Invisible Semi Matte Finish, Sebum Balancing, Reef Friendly, Korean Skincare",$17.25,4.4 out of 5 stars,206 ratings,In Stock,https://www.amazon.com/sspa/click?ie=UTF8&spc=MTo0NTAwMzk5NjExMzQ0OTE1OjE2ODg5NzEwMDM6c3BfYXRmX25leHQ6MjAwMTM1Mzc3Mzc5Mjk4OjowOjo&url=%2FCOSRX-Sunscreen-Whitecast-Vitalizing-Protection%2Fdp%2FB09ZY7468X%2Fref%3Dsr_1_51_sspa%3Fcrid%3DBCICLEMKVXND%26keywords%3Dsunscreen%26qid%3D1688971003%26sprefix%3Dsuns%252Caps%252C533%26sr%3D8-51-spons%26sp_csd%3Dd2lkZ2V0TmFtZT1zcF9hdGZfbmV4dA%26psc%3D1,https://m.media-amazon.com/images/I/31NWn+HeB5L._SY300_SX300_.jpg
"Alba Botanica Sunscreen for Face and Body, While Wet Sunscreen Lotion, Broad Spectrum SPF 40, Water Resistant Sunscreen for Wet and Dry Skin, 3 fl. oz. Bottle",$14.01,4.3 out of 5 stars,35 ratings,In Stock,https://www.amazon.com/sspa/click?ie=UTF8&spc=MTo0NTAwMzk5NjExMzQ0OTE1OjE2ODg5NzEwMDM6c3BfYXRmX25leHQ6MjAwMTY1NzMxNzU4Mjk4OjowOjo&url=%2FAlba-Botanica-While-Sunscreen-Lotion%2Fdp%2FB09BPFYPW2%2Fref%3Dsr_1_52_sspa%3Fcrid%3DBCICLEMKVXND%26keywords%3Dsunscreen%26qid%3D1688971003%26sprefix%3Dsuns%252Caps%252C533%26sr%3D8-52-spons%26sp_csd%3Dd2lkZ2V0TmFtZT1zcF9hdGZfbmV4dA%26psc%3D1,https://m.media-amazon.com/images/I/41X8LUr8u5L._SX300_SY300_QL70_ML2_.jpg
"Coppertone SPORT Sunscreen SPF 30, Water Resistant Sunscreen Lotion, Broad Spectrum SPF 30 Sunscreen, Bulk Sunscreen Pack, 7 Fl Oz Bottle, Pack of 2",$13.98,4.8 out of 5 stars,892 ratings,,https://www.amazon.com/Coppertone-Sunscreen-Resistant-Lotion-Spectrum/dp/B09P4CL9BH/ref=sr_1_53?crid=BCICLEMKVXND&keywords=sunscreen&qid=1688971003&sprefix=suns%2Caps%2C533&sr=8-53,https://m.media-amazon.com/images/I/51Pwn5ST9jL._SX300_SY300_QL70_ML2_.jpg
"Thinksport SPF 50+ Mineral Sunscreen – Safe, Natural Sunblock for Sports & Active Use - Water Resistant Sun Cream –UVA/UVB Sun Protection – Vegan, Reef Friendly Sun Lotion, 6oz",$22.99,4.4 out of 5 stars,"3,713 ratings",In Stock,https://www.amazon.com/Thinksport-Sunscreen-SPF-50-Ounce/dp/B00K3JQO9Y/ref=sr_1_54?crid=BCICLEMKVXND&keywords=sunscreen&qid=1688971003&sprefix=suns%2Caps%2C533&sr=8-54,https://m.media-amazon.com/images/I/31C5BTkV2fL._SX300_SY300_QL70_ML2_.jpg
